{
  "id": "art.plane",
  "name": "Plane",
  "category": "primitive",
  "version": "0.1.0",
  "origin2d": {
    "baseShape": "rectangle",
    "constructionMethod": "extrude"
  },
  "topology": {
    "genus": 0,
    "eulerCharacteristic": 2,
    "quadPct": 100,
    "capStyle": "quad",
    "hasPoles": false,
    "poleNote": "No poles",
    "deformsWithRig": false
  },
  "lod": [
    {
      "level": 0,
      "triangles": 2,
      "vertices": 4
    },
    {
      "level": 1,
      "triangles": 2,
      "vertices": 4,
      "reductionRule": "Reduce detail from 2 to 2 tris"
    },
    {
      "level": 2,
      "triangles": 2,
      "vertices": 4,
      "reductionRule": "Reduce detail from 2 to 2 tris"
    },
    {
      "level": 3,
      "triangles": 2,
      "vertices": 4,
      "reductionRule": "Reduce to minimal proxy (2 tris)"
    }
  ],
  "annotations": {
    "pitfall": "Backface culling — plane invisible from behind unless double-sided",
    "construction": "Single quad (2 tris) or subdivided grid"
  },
  "provenance": "library-native",
  "source": "3d_shapes_full_package_v7/shape_catalogue.json"
}
