{
  "id": "art.beak",
  "name": "Beak",
  "category": "organic_head",
  "version": "0.1.0",
  "origin2d": {
    "baseShape": "triangle",
    "constructionMethod": "taper_extrude"
  },
  "topology": {
    "genus": 0,
    "eulerCharacteristic": 2,
    "quadPct": 0,
    "capStyle": "fan_tri",
    "hasPoles": false,
    "poleNote": "No poles — flat wedge shape",
    "deformsWithRig": true
  },
  "lod": [
    {
      "level": 0,
      "triangles": 16,
      "vertices": 10
    },
    {
      "level": 1,
      "triangles": 10,
      "vertices": 7,
      "reductionRule": "Reduce detail from 16 to 10 tris"
    },
    {
      "level": 2,
      "triangles": 6,
      "vertices": 5,
      "reductionRule": "Reduce detail from 10 to 6 tris"
    },
    {
      "level": 3,
      "triangles": 2,
      "vertices": 4,
      "reductionRule": "Reduce to minimal proxy (2 tris)"
    }
  ],
  "annotations": {
    "pitfall": "Two halves must share exact same socket transform to avoid gaps when closed",
    "construction": "Two mirrored triangular wedge halves, hinge at base"
  },
  "provenance": "library-native",
  "source": "3d_shapes_full_package_v7/shape_catalogue.json"
}
