{
  "id": "art.tail_bushy",
  "name": "Tail Bushy",
  "category": "organic_body",
  "version": "0.1.0",
  "origin2d": {
    "baseShape": "circle",
    "constructionMethod": "taper_extrude"
  },
  "topology": {
    "genus": 0,
    "eulerCharacteristic": 2,
    "quadPct": 20,
    "capStyle": "none",
    "hasPoles": false,
    "poleNote": "No sharp poles",
    "deformsWithRig": true
  },
  "lod": [
    {
      "level": 0,
      "triangles": 72,
      "vertices": 42
    },
    {
      "level": 1,
      "triangles": 40,
      "vertices": 24,
      "reductionRule": "Reduce detail from 72 to 40 tris"
    },
    {
      "level": 2,
      "triangles": 20,
      "vertices": 13,
      "reductionRule": "Reduce detail from 40 to 20 tris"
    },
    {
      "level": 3,
      "triangles": 6,
      "vertices": 5,
      "reductionRule": "Reduce to minimal proxy (6 tris)"
    }
  ],
  "annotations": {
    "pitfall": "Fur card overdraw — always billboard at distance",
    "construction": "Tapered tube with flared cross-section + fur cards"
  },
  "provenance": "library-native",
  "source": "3d_shapes_full_package_v7/shape_catalogue.json"
}
