{
  "id": "art.potion",
  "name": "Potion",
  "category": "item",
  "version": "0.1.0",
  "origin2d": {
    "baseShape": "circle",
    "constructionMethod": "loft"
  },
  "topology": {
    "genus": 0,
    "eulerCharacteristic": 2,
    "quadPct": 0,
    "capStyle": "fan_tri",
    "hasPoles": true,
    "poleNote": "Neck cap is N-pole",
    "deformsWithRig": false
  },
  "lod": [
    {
      "level": 0,
      "triangles": 64,
      "vertices": 37
    },
    {
      "level": 1,
      "triangles": 36,
      "vertices": 22,
      "reductionRule": "Reduce detail from 64 to 36 tris"
    },
    {
      "level": 2,
      "triangles": 20,
      "vertices": 13,
      "reductionRule": "Reduce detail from 36 to 20 tris"
    },
    {
      "level": 3,
      "triangles": 8,
      "vertices": 6,
      "reductionRule": "Reduce to minimal proxy (8 tris)"
    }
  ],
  "annotations": {
    "pitfall": "Join seam between sphere and cylinder needs vertex-matched ring",
    "construction": "Sphere body + cylinder neck joined at shared ring"
  },
  "provenance": "library-native",
  "source": "3d_shapes_full_package_v7/shape_catalogue.json"
}
