{
  "id": "art.ear_floppy",
  "name": "Ear Floppy",
  "category": "organic_head",
  "version": "0.1.0",
  "origin2d": {
    "baseShape": "spline",
    "constructionMethod": "loft"
  },
  "topology": {
    "genus": 0,
    "eulerCharacteristic": 2,
    "quadPct": 20,
    "capStyle": "none",
    "hasPoles": false,
    "poleNote": "No poles — deforms via loop bend",
    "deformsWithRig": true
  },
  "lod": [
    {
      "level": 0,
      "triangles": 30,
      "vertices": 18
    },
    {
      "level": 1,
      "triangles": 20,
      "vertices": 13,
      "reductionRule": "Reduce detail from 30 to 20 tris"
    },
    {
      "level": 2,
      "triangles": 12,
      "vertices": 8,
      "reductionRule": "Reduce detail from 20 to 12 tris"
    },
    {
      "level": 3,
      "triangles": 4,
      "vertices": 4,
      "reductionRule": "Reduce to minimal proxy (4 tris)"
    }
  ],
  "annotations": {
    "pitfall": "Needs extra edge loops mid-length for rig deformation",
    "construction": "Curved loft with gravity droop applied to spline"
  },
  "provenance": "library-native",
  "source": "3d_shapes_full_package_v7/shape_catalogue.json"
}
