{
  "id": "art.tail_straight",
  "name": "Tail Straight",
  "category": "organic_body",
  "version": "0.1.0",
  "origin2d": {
    "baseShape": "circle",
    "constructionMethod": "taper_extrude"
  },
  "topology": {
    "genus": 0,
    "eulerCharacteristic": 2,
    "quadPct": 0,
    "capStyle": "fan_tri",
    "hasPoles": true,
    "poleNote": "Tip is N-pole",
    "deformsWithRig": true
  },
  "lod": [
    {
      "level": 0,
      "triangles": 36,
      "vertices": 22
    },
    {
      "level": 1,
      "triangles": 20,
      "vertices": 13,
      "reductionRule": "Reduce detail from 36 to 20 tris"
    },
    {
      "level": 2,
      "triangles": 12,
      "vertices": 8,
      "reductionRule": "Reduce detail from 20 to 12 tris"
    },
    {
      "level": 3,
      "triangles": 4,
      "vertices": 4,
      "reductionRule": "Reduce to minimal proxy (4 tris)"
    }
  ],
  "annotations": {
    "pitfall": "Needs rig loops along length for wag/sway animation",
    "construction": "Tapered tube, straight axis"
  },
  "provenance": "library-native",
  "source": "3d_shapes_full_package_v7/shape_catalogue.json"
}
