{
  "id": "art.prism_tri",
  "name": "Prism Tri",
  "category": "extruded_poly",
  "version": "0.1.0",
  "origin2d": {
    "baseShape": "triangle",
    "constructionMethod": "extrude"
  },
  "topology": {
    "genus": 0,
    "eulerCharacteristic": 2,
    "quadPct": 0,
    "capStyle": "fan_tri",
    "hasPoles": false,
    "poleNote": "No poles",
    "deformsWithRig": false
  },
  "lod": [
    {
      "level": 0,
      "triangles": 8,
      "vertices": 6
    },
    {
      "level": 1,
      "triangles": 8,
      "vertices": 6,
      "reductionRule": "Reduce detail from 8 to 8 tris"
    },
    {
      "level": 2,
      "triangles": 8,
      "vertices": 6,
      "reductionRule": "Reduce detail from 8 to 8 tris"
    },
    {
      "level": 3,
      "triangles": 8,
      "vertices": 6,
      "reductionRule": "Reduce to minimal proxy (8 tris)"
    }
  ],
  "annotations": {
    "pitfall": "None — minimal geometry, always clean",
    "construction": "Triangle profile extruded along depth"
  },
  "provenance": "library-native",
  "source": "3d_shapes_full_package_v7/shape_catalogue.json"
}
